{
    "$schema": "http://json-schema.org/draft-06/schema#",
    "$ref": "#/definitions/NflDraftAthleteSchema",
    "definitions": {
        "NflDraftAthleteSchema": {
            "type": "object",
            "additionalProperties": false,
            "properties": {
                "$ref": {
                    "type": "string",
                    "format": "uri",
                    "qt-uri-protocols": [
                        "http"
                    ]
                },
                "id": {
                    "type": "string",
                    "format": "integer"
                },
                "guid": {
                    "type": "string",
                    "format": "uuid"
                },
                "firstName": {
                    "type": "string"
                },
                "lastName": {
                    "type": "string"
                },
                "fullName": {
                    "type": "string"
                },
                "displayName": {
                    "type": "string"
                },
                "shortName": {
                    "type": "string"
                },
                "weight": {
                    "type": "number"
                },
                "displayWeight": {
                    "type": "string"
                },
                "height": {
                    "type": "number"
                },
                "displayHeight": {
                    "type": "string"
                },
                "links": {
                    "type": "array",
                    "items": {
                        "$ref": "#/definitions/Link"
                    }
                },
                "college": {
                    "$ref": "#/definitions/Athlete"
                },
                "position": {
                    "$ref": "#/definitions/Position"
                },
                "positions": {
                    "type": "array",
                    "items": {
                        "$ref": "#/definitions/Position"
                    }
                },
                "team": {
                    "$ref": "#/definitions/Athlete"
                },
                "attributes": {
                    "type": "array",
                    "items": {
                        "$ref": "#/definitions/Attribute"
                    }
                },
                "analysis": {
                    "type": "array",
                    "items": {
                        "$ref": "#/definitions/Analysis"
                    }
                },
                "pick": {
                    "$ref": "#/definitions/Athlete"
                },
                "athlete": {
                    "$ref": "#/definitions/Athlete"
                },
                "logo": {
                    "$ref": "#/definitions/Logo"
                }
            },
            "required": [
                "$ref",
                "analysis",
                "athlete",
                "attributes",
                "college",
                "displayHeight",
                "displayName",
                "displayWeight",
                "firstName",
                "fullName",
                "guid",
                "height",
                "id",
                "lastName",
                "links",
                "logo",
                "pick",
                "position",
                "positions",
                "shortName",
                "team",
                "weight"
            ],
            "title": "NflDraftAthleteSchema"
        },
        "Analysis": {
            "type": "object",
            "additionalProperties": false,
            "properties": {
                "id": {
                    "type": "string",
                    "format": "integer"
                },
                "type": {
                    "type": "string"
                },
                "text": {
                    "type": "string"
                },
                "grade": {
                    "type": "integer"
                }
            },
            "required": [
                "id",
                "type"
            ],
            "title": "Analysis"
        },
        "Athlete": {
            "type": "object",
            "additionalProperties": false,
            "properties": {
                "$ref": {
                    "type": "string",
                    "format": "uri",
                    "qt-uri-protocols": [
                        "http"
                    ]
                }
            },
            "required": [
                "$ref"
            ],
            "title": "Athlete"
        },
        "Attribute": {
            "type": "object",
            "additionalProperties": false,
            "properties": {
                "type": {
                    "type": "integer"
                },
                "name": {
                    "type": "string"
                },
                "displayName": {
                    "type": "string"
                },
                "abbreviation": {
                    "type": "string"
                },
                "value": {
                    "type": "number"
                },
                "displayValue": {
                    "type": "string"
                }
            },
            "required": [
                "abbreviation",
                "displayName",
                "displayValue",
                "name",
                "type",
                "value"
            ],
            "title": "Attribute"
        },
        "Link": {
            "type": "object",
            "additionalProperties": false,
            "properties": {
                "language": {
                    "type": "string"
                },
                "rel": {
                    "type": "array",
                    "items": {
                        "type": "string"
                    }
                },
                "href": {
                    "type": "string",
                    "format": "uri",
                    "qt-uri-protocols": [
                        "https"
                    ]
                },
                "text": {
                    "type": "string"
                },
                "shortText": {
                    "type": "string"
                },
                "isExternal": {
                    "type": "boolean"
                },
                "isPremium": {
                    "type": "boolean"
                }
            },
            "required": [
                "href",
                "isExternal",
                "isPremium",
                "language",
                "rel",
                "shortText",
                "text"
            ],
            "title": "Link"
        },
        "Logo": {
            "type": "object",
            "additionalProperties": false,
            "properties": {
                "href": {
                    "type": "string",
                    "format": "uri",
                    "qt-uri-protocols": [
                        "https"
                    ],
                    "qt-uri-extensions": [
                        ".png"
                    ]
                },
                "width": {
                    "type": "integer"
                },
                "height": {
                    "type": "integer"
                },
                "alt": {
                    "type": "string"
                },
                "rel": {
                    "type": "array",
                    "items": {
                        "type": "string"
                    }
                },
                "lastUpdated": {
                    "type": "string"
                }
            },
            "required": [
                "alt",
                "height",
                "href",
                "lastUpdated",
                "rel",
                "width"
            ],
            "title": "Logo"
        },
        "Position": {
            "type": "object",
            "additionalProperties": false,
            "properties": {
                "$ref": {
                    "type": "string",
                    "format": "uri",
                    "qt-uri-protocols": [
                        "http"
                    ]
                },
                "id": {
                    "type": "string",
                    "format": "integer"
                },
                "name": {
                    "type": "string"
                },
                "displayName": {
                    "type": "string"
                },
                "abbreviation": {
                    "type": "string"
                },
                "leaf": {
                    "type": "boolean"
                },
                "parent": {
                    "$ref": "#/definitions/Athlete"
                }
            },
            "required": [
                "$ref",
                "abbreviation",
                "displayName",
                "id",
                "leaf",
                "name",
                "parent"
            ],
            "title": "Position"
        }
    }
}
